{"$defs":{"digest":{"pattern":"^[a-f0-9]{64}$","type":"string"},"relativePath":{"pattern":"^(?!/)(?!.*(^|/)\\.\\.(?:/|$))[A-Za-z0-9._/-]+$","type":"string"},"revision":{"pattern":"^[a-f0-9]{40}$","type":"string"}},"$id":"clawgym.public_schema_bundle.v1","$schema":"https://json-schema.org/draft/2020-12/schema","additionalProperties":false,"description":"An immutable ClawGym-owned release inventory with source and released-copy digests.","properties":{"bundle_digest":{"$ref":"#/$defs/digest"},"bundle_id":{"pattern":"^[A-Za-z0-9][A-Za-z0-9._-]{0,127}$","type":"string"},"publisher":{"const":"clawgym"},"publisher_revision":{"$ref":"#/$defs/revision"},"schema_id":{"const":"clawgym.public_schema_bundle.v1"},"schema_refs":{"items":{"additionalProperties":false,"properties":{"owner_repository":{"const":"clawgym"},"owner_revision":{"$ref":"#/$defs/revision"},"released_path":{"$ref":"#/$defs/relativePath"},"released_sha256_digest":{"$ref":"#/$defs/digest"},"schema_id":{"pattern":"^[a-z0-9_.-]+$","type":"string"},"source_path":{"$ref":"#/$defs/relativePath"},"source_sha256_digest":{"$ref":"#/$defs/digest"}},"required":["schema_id","owner_repository","owner_revision","source_path","source_sha256_digest","released_path","released_sha256_digest"],"type":"object"},"minItems":1,"type":"array","uniqueItems":true}},"required":["schema_id","bundle_id","publisher","publisher_revision","schema_refs","bundle_digest"],"title":"ClawGym Public Schema Bundle v1","type":"object"}