{"bundle_digest":"7695e77f6df52c0e92ea3a9aabe9a9cb09e736e7a1a974e5fbec492bd081bc43","bundle_id":"clawgym-g04-public-v1","publisher":"clawgym","publisher_revision":"5464956b305e8d38aa5b6c1f3864b7aaca54410b","schema_id":"clawgym.public_schema_bundle.v1","schema_refs":[{"owner_repository":"clawgym","owner_revision":"5464956b305e8d38aa5b6c1f3864b7aaca54410b","released_path":"released/clawgym.logical_invocation_profile.v1.schema.json","released_sha256_digest":"583392e7b3f0a440daa39c0a17c5c179ce4a87cccffdcb4178982abcd63ac7f1","schema_id":"clawgym.logical_invocation_profile.v1","source_path":"source/clawgym.logical_invocation_profile.v1.schema.json","source_sha256_digest":"583392e7b3f0a440daa39c0a17c5c179ce4a87cccffdcb4178982abcd63ac7f1"},{"owner_repository":"clawgym","owner_revision":"5464956b305e8d38aa5b6c1f3864b7aaca54410b","released_path":"released/clawgym.tool_grant.v1.schema.json","released_sha256_digest":"67785b8d1e9202f04a5f638abb0f7146f8a26b09983c4870433e361307e4507e","schema_id":"clawgym.tool_grant.v1","source_path":"source/clawgym.tool_grant.v1.schema.json","source_sha256_digest":"67785b8d1e9202f04a5f638abb0f7146f8a26b09983c4870433e361307e4507e"},{"owner_repository":"clawgym","owner_revision":"5464956b305e8d38aa5b6c1f3864b7aaca54410b","released_path":"released/clawgym.public_schema_bundle.v1.schema.json","released_sha256_digest":"9ada7e83ec94b1e7c5469615d4f5a212cb09eb96671384a0a829d2ddf1de795e","schema_id":"clawgym.public_schema_bundle.v1","source_path":"source/clawgym.public_schema_bundle.v1.schema.json","source_sha256_digest":"9ada7e83ec94b1e7c5469615d4f5a212cb09eb96671384a0a829d2ddf1de795e"}]}